category,text
business,"Will China help Russia? That has been a big question since Russia invaded Ukraine last week. The two nations have forged close economic ties in recent years, with Chinese leader Xi Jinping calling Russian President Vladimir Putin his ""best and bosom friend"" in Moscow in 2019. "
business,The Federal Reserve is going to raise interest rates at its next meeting on March 16 to try to put a lid on inflation. That much we know. The only question is whether the Fed will boost rates by a quarter of a percentage point or a half-point. 
business,Russia's war in Ukraine is roiling the global economy as policymakers race to get high inflation under control. But China's response to its worst outbreak of Covid-19 in two years is a reminder that the conflict isn't the only risk to the recovery.
business,Getting to know new colleagues through a box on your screen while working from home can have its challenges. 
business,Returning to the workforce after a career break can be difficult.
business,"If you worked from a state other than the one where your employer is based, you may have to pay up for that privilege come tax time. "
business,"You probably already know that you need a good credit score to get the best interest rates on a mortgage or auto loan, which can make a big difference to your budget over time. "
business,"Mortgage rates are rising again amid fears of soaring inflation. The 30-year fixed-rate mortgage averaged 3.85% in the week ending March 10, up from 3.76% the week before, according to Freddie Mac."
business,"Homeowners saw massive increases in wealth over the past decade, but most of the gains went to the wealthiest US households. "
business,"There are countless things you need to think about when you get your first full-time job: How to make a good impression on your boss, connect with your colleagues and figure out how to spend that first paycheck."
business,"With Russia's internationally condemned invasion of Ukraine, one thing is certain: No one knows exactly how things will play out. "
business,"Russia's invasion of Ukraine helped send mortgage rates lower last week. This is the second week in a row rates have fallen, reversing weeks of increases that pushed rates close to 4%."
business,"One of the most important things you can do when it comes to securing your financial future is to consistently live below your means. Once you've done that, however, the next step is to take any leftover cash -- whether it's a few dollars or a few hundred dollars -- and put it to work. "
business,"Nearly half a million families are estimated to be stranded without reliable child care, exacerbating the nation's worker shortage as parents continue to stay home, according to a new report."
business,"Across the US rent is rising so fast that in many cities buying has become more affordable than renting, even with sky-high home sale prices."
business,"Mortgage rates increased again, rising to a level not seen since summer 2019."
business,"Inflation is rampant in the pandemic economy, but that didn't keep Americans from opening up their wallets last month. "
business,America's rising prices were unrelenting in January. Another key inflation measure showed prices rising more than expected last month.
business,The last few weeks have served as a stark reminder that stocks can be volatile — sometimes extremely so. 
business,"Rents in Manhattan are once again hitting new record highs, after cratering during the pandemic."
business,"Confusion. Amnesia. New paperwork. Delays getting through to the IRS. These are some of the top pandemic-induced frustrations marking this tax filing season, both for tax preparers and their clients. "
business,"A new generation of workers needs financial information that speaks to the unique economic struggles they're facing today. Diversifying, a new podcast from CNN Audio, changes the conversation we have about finance by addressing the emotional side of money while providing actionable steps to start investing, tackling debt and more.  "
business,"There is the growing threat that rising inflation will overwhelm the nation's strong economic recovery, resulting in a recession.  "
business,"Ensuring pay equity, creating equitable supply chains, prioritizing female representation across female-driven industries and seeking strategic partnerships that support women will help create a new cycle of lifting other women as we climb."
business,"Over the past several months, consumer prices have risen across the board, especially for basic needs like food, gas and shelter. And low- and middle-income families are getting hit the hardest. Not only do they spend a larger share of their income meeting basic needs, they tend to have less savings to help cushion the blow of higher prices. "
business,"Rising inflation is hitting all sectors of the economy. The overall rate of inflation on an annual basis reached 7.5% at the end of January, the highest level since 1982. Gas prices, in particular, are rising especially fast, reaching $4.25 a gallon on Wednesday, up from about $2.86 per gallon last March. That means filling a 20-gallon tank right now costs $85, up from $57.20 last year at this time.  "
business,"Building more homes for low- and moderate-income families and first-time homebuyers, and equipping these families with reliable and affordable financing tools so they can compete to buy these homes, is essential if we're to solve the nation's affordable homeownership crisis. "
business,"With pressure to contain inflation mounting, the Fed may raise interest rates faster than it currently predicts, and further depress economic growth in 2023."
business,"The Heating and Cooling Relief Act would significantly increase funding for the government's Low Income Home Energy Assistance Program, which helps low- and moderate-income families pay their home energy bills. "
business,The NextGen Feds Act seeks to provide a pathway to full-time federal service to interns who successfully complete at least one year of federal internship service. 
business,"The potentially largest contributor to a lag in employment recovery is an exodus of older workers from the labor force. For some, this may reflect health concerns related to the pandemic. Others may have reconsidered their need to work as housing and financial asset prices grew substantially."
business,It's going to take adding inventory of all types to significantly slow price growth and unlock homeownership for more Americans.
business,The rise of central bank digital currencies highlights the importance of decentralized cryptocurrencies that are relatively private and not controlled by any government. 
business,"About 20% of greenhouse gases in the US come from homes. These are problems we can solve, as homeowners, with new technology, and through government incentives."
business,"As has happened with ""SNL"" in the past, expectations that the show must jump on every egregious event coming out of Washington sometimes winds up forcing creative decisions. In the case of Trump, there were a slew of those events, many so closely resembling the theater of the absurd they were almost impossible to parody."
business,"The Capitol insurrection — and the egregious attempts by one party first to blow up the peaceful transfer of power, the bedrock of our democracy, and then to make several attempts to ensure no election would ever again deny them power — has sweeping implications for the future. "
business,"Christmas movies have always served up huge dollops of fantasy, so it's not surprising that a lot of folks enjoy this escape into fictional romance."
business,"Learning to think and act like an entrepreneur emboldens students to take charge of their own destinies, and in doing so, it powers the American Dream. "
business,The Ban Conflicted Trading Act would ban members of Congress from trading individual stocks or similar investments and prohibit them from serving on corporate boards while in office.
business,"It's peak ski season in Park City, and the area is busier than ever before. But our employees are getting sick, as are workers at other businesses, which is creating a massive domino effect in the city."
business,"It's important to enact legislation to put historic levels of funding behind strengthening our supply chains, accelerating research and development in critical technologies, rebuilding manufacturing capabilities across America, and driving greater equity in STEM research and education."
business,Both habitat loss and the wildlife trade increase the likelihood that diseases will make the jump from animals to humans.
business,We would have millions fewer jobs today if Congress had not enacted the Covid relief and recovery measures it did. 
business,Market volatility will continue until investors figure out whether the Fed is actually serious about raising rates aggressively.
business,"With fewer people getting sick, there should be more workers in the transportation sector (truckers and dock workers, for instance) — helping to get goods from producers to consumers."
business,Congress should pass a full-year spending bill to strengthen the programs that provide essential support.
business,"Expanding recruitment efforts to people who have work experience but don't have degrees could open significant opportunities for job seekers, while broadening the talent pipeline for companies. "
business,How do you break the ice again after more than a year of virtual meetings?
business,"Teens won millions of dollars in video game competitions in 2019, and they're set to do it again this year. Last year, the oldest finalist in the most competitive rounds of the ""Fortnite"" World Cup was only 24 years old, despite the World Cup being open to all ages online."
business,"When Jeremy Wang started streaming on Twitch in 2016, he was an unknown twenty-something with a few coding internships under his belt. Almost no one knew his name or what he looked like. The latter, at least, was by design: Wang, now 28, initially wore a mask everywhere — whether playing video games at competitive events or streaming from a closet while visiting his sister in New York. "
business,"Gaming company 100 Thieves has built the biggest esports facility in the United States. Located in Culver City, Los Angeles, the 15,000-square-foot compound may have an arcade and an outdoor basketball hoop, but it also has designated training rooms for playing video games professionally."
business,"Esports are already online (obviously), but the pandemic is still creating huge challenges "
business,"Corporate America must be compelled to fess up about the financial risks posed by the climate crisis, a coalition of state attorneys general told the Securities and Exchange Commission on Monday."
business,"Flooding is the most costly natural disaster in the United States. As climate change increases the risk of flood damage, a new report finds that the country's National Flood Insurance Program is greatly underestimating the financial threat to homeowners."
business,There's much more to Mauritius than golden beaches and grand hotels. SKC Surat has grown from a fruit and veg market trader to the country's market leader.
business,Susan Bennett of suburban Atlanta says she is the voice of the original U.S. version of Siri on Apple's iPhone.
business,The federal government's academy for merchant mariners is halting a key training program that sends students thousands of miles away from campus on commercial ships after a 19-year-old student was allegedly raped at sea.
business,International shipping giant Maersk has suspended five crew members and launched an investigation in the wake of an explosive blog post from a student at a federal service academy who said she was raped in 2019 on one of the company's ships when she was 19 years old.
