category,text
world,Venezuelans Vote Early in Referendum on Chavez Rule (Reuters) Reuters - Venezuelans turned out early\and in large numbers on Sunday to vote in a historic referendum\that will either remove left-wing President Hugo Chavez from\office or give him a new mandate to govern for the next two\years.
world,"S.Koreans Clash with Police on Iraq Troop Dispatch (Reuters) Reuters - South Korean police used water cannon in\central Seoul Sunday to disperse at least 7,000 protesters\urging the government to reverse a controversial decision to\send more troops to Iraq."
world,"Palestinians in Israeli Jails Start Hunger Strike (Reuters) Reuters - Thousands of Palestinian\prisoners in Israeli jails began a hunger strike for better\conditions Sunday, but Israel's security minister said he\didn't care if they starved to death."
world,"Seven Georgian soldiers wounded as South Ossetia ceasefire violated (AFP) AFP - Sporadic gunfire and shelling took place overnight in the disputed Georgian region of South Ossetia in violation of a fragile ceasefire, wounding seven Georgian servicemen."
world,"Rwandan Troops Arrive in Darfur (AP) AP - Dozens of Rwandan soldiers flew into Sudan's troubled Darfur region Sunday, the first foreign armed force deployed in the area since Arab militiamen began a rampage against black African farmers, killing thousands."
world,"Rwanda Troops Airlifted to Start AU Mission in Darfur (Reuters) Reuters - Rwandan troops were airlifted on Sunday\to Sudan's Darfur as the first foreign force there, mandated to\protect observers monitoring a cease-fire between the Sudanese\government and rebels in the troubled western region."
world,"Bomb at India Independence Parade Kills 15 (AP) AP - A bomb exploded during an Independence Day parade in India's remote northeast Sunday, killing at least 15 people, including schoolchildren, while a rocket attack during a celebration at a school in the separatist region of Kashmir injured 17, officials said."
world,Australian FM to visit North Korea for talks on nuclear crisis (AFP) AFP - Australia's foreign minister will pay a rare visit to North Korea this week for talks on its nuclear programme after creating a stir here by warning a North Korean missile would be able to hit Sydney.
world,"Kerry Campaign Helping With Fla. Recovery (AP) AP - Democratic presidential candidate John Kerry does not plan to visit Florida in the aftermath of Hurricane Charley because he's concerned his campaign entourage could distract from recovery efforts, he said Saturday."
world,Edwards Calls for Changes to Drug Plans (AP) AP - Democratic vice presidential candidate John Edwards called for changes to prescription drug programs and praised running mate John Kerry's military and government service at an outdoor campaign rally here Saturday.
world,"Kerry leading Bush in key swing states (AFP) AFP - Although polls show the US presidential race a virtual dead heat, Democrat John Kerry appears to be gaining an edge over George W. Bush among the key states that could decide the outcome."
world,"Democratic Senator Urges Energy Reform (AP) AP - Congress must pass legislation to protect the nation's electricity grid if it wants to avoid repeats of the devastating outages that rolled across eight states last year, Sen. Maria Cantwell, D-Wash., said Saturday."
world,"Missouri Attorney General Sues EPA (AP) AP - Missouri's attorney general sued the federal environmental agency on Friday, saying it is behind on testing the state's air for lead as required by law."
world,"Mortars Mark Opening of Iraqi Political Conference  BAGHDAD (Reuters) - Insurgents fired mortars at a meeting  where Iraqi leaders met to pick an interim national assembly  Sunday, killing at least two people in a grim reminder of the  country's tortured path toward democracy."
world,"Japan Ministers Pay Homage at Shrine for War Dead  TOKYO (Reuters) - Three Japanese ministers paid homage at a  controversial shrine for war dead Sunday, the 59th anniversary  of Japan's World War II surrender, a move that drew anger from  Asian neighbors."
world,"Najaf battle a crucial test for Allawi Clashes between US troops and Sadr militiamen escalated Thursday, as the US surrounded Najaf for possible siege."
world,"Who are Ch #225;vez's opponents? On Sunday, Venezuelans will decide whether to cut short the president's term, which is due to end in 2006."
world,"Eye on Athens, China stresses a 'frugal' 2008 Olympics Amid a reevaluation, officials this week pushed the completion date for venues back to 2007."
world,Tense Iraq debates new assembly Talks on setting up an Iraqi assembly continue despite fresh violence in Baghdad and the Shia stronghold of Najaf.
world,Venezuelans vote on Chavez rule A referendum is under way in Venezuela to decide if President Hugo Chavez should remain in office.
world,"Pope celebrates Mass in Lourdes An ailing Pope John Paul II says Mass at Lourdes, the French shrine revered by Roman Catholics."
world,Rwandan soldiers arrive in Sudan Rwandan troops arrive in Sudan to help protect ceasefire monitors in the war-ravaged Darfur region.
world,Thorpe leads big guns Ian Thorpe sets the fastest time in the 200m freestyle as swimming's top names cruise into the semi-finals.
world,Mystery over judo 'protest' Iran's Arash Miresmaili withdraws from the Olympics amid confusion over his reasons.
world,Jackson probe 'should be public' Santa Barbara's sheriff asks a judge if he can release the results of an inquiry into Michael Jackson's treatment by police.
world,Rumsfeld warning for Iraq's Sadr The Iraq crisis and differences over Nato loom over the US Defence Secretary's meeting with his Russian counterpart.
world,"South Ossetia ceasefire discussed Georgia and South Ossetia negotiate the details of a truce they forged, despite reports of a village attack."
world,'Mock executions' for UK hostage The British journalist who was kidnapped in Iraq says he faced mock executions and tried to escape his captors.
world,India carries out rare execution A man convicted of raping and killing a schoolgirl is hanged in India's first execution in nine years.
world,Rowling reads to gathered fans Harry Potter author JK Rowling delights a small group of fans by giving her first public reading in Scotland for four years.
world,"President's fate is on the line in Venezuela CARACAS -- Partisans on both sides are calling it the most polarized and important election in Venezuela's history, a presidential recall referendum today that will determine the course of democracy here and could buffet world oil prices. Both campaigns are also utterly convinced they will win."
world,"Lamenting London's double-deckers Up-to-date buses supplant symbol LONDON -- On a sweltering August afternoon, George Watson wedged himself, his briefcase, his sports jacket, and his raincoat into a narrow seat aboard the profoundly un-air-conditioned No. 38 bus, as it resumed its rumble down High Holborn, in London's bustling city center."
world,"Clash among warlords casts doubt on Afghanistan's security KABUL, Afghanistan -- Rival militias clashed in western Afghanistan yesterday, reportedly killing 21 people and ramping up concern about security as the country prepares for landmark elections."
world,"Options running out as Najaf talks collapse BAGHDAD -- After more than a week of fighting between the Mahdi Army and the combined US and Iraqi forces in Najaf, Baghdad's Sadr City, and a half-dozen other cities, analysts say neither interim Prime Minister Iyad Allawi nor radical cleric Moqtada al-Sadr had any good options left other than to talk."
world,"Japanese youths' rage fuels wave of violent crime SASEBO, Japan -- On a cloudless afternoon in this sleepy port city, an 11-year-old girl drenched in blood and clutching a box cutter walked into the lunchroom at her elementary school. Teachers and students froze, assuming the sixth-grader known for her lighthearted nature had gravely hurt herself -- but she quickly dispelled that impression, witnesses said, by uttering a few ..."
world,"NATO proclaims victory in Bosnia SARAJEVO, Bosnia-Herzegovina -- When NATO forces first came to Bosnia nearly a decade ago, they lived in heavily guarded compounds, patrolled the streets in tanks, and often wore full body armor."
world,"Koreans of mixed race tackle a prejudice SEOUL -- For years, Lee Yu Jin kept her secret. Whenever anybody asked -- and they did all the time as her celebrity as an actress and model spread -- she simply denied the rumors. No, she was not a foreigner. She was Korean."
world,"Venezuela Holds Referendum on President CARACAS, Venezuela - The opposition's long and bitter campaign to oust Venezuelan President Hugo Chavez finally came down to a recall referendum Sunday, with the leftist leader hoping a huge turnout among the poor will keep him in power.    Activists on both sides set off fireworks and blared recordings of bugle music to wake voters hours before dawn, hoping for a flood of early votes in their favor..."
world,"Floridians Return to Storm-Ravaged Homes PUNTA GORDA, Fla. - After getting a first look at the widespread damage left behind by Hurricane Charley, Florida residents were faced with the arduous task of sorting through the wreckage, and for some, starting over again..."
world,"Charley May Not Spike Insurance Premiums MIAMI - Hurricane Charley probably will not cause Floridians' insurance premiums to skyrocket like 1992's Andrew, and fewer insurers should go bankrupt from paying out damages expected to reach the billions of dollars, state and industry officials said Saturday.    They say previous premium increases and overhauls made because of Andrew, the most expensive natural disaster in U.S..."
world,"Florida Residents Face Hurricane Wreckage PUNTA GORDA, Fla. - After getting a first look at the widespread damage left behind by Hurricane Charley, Florida residents were faced with the arduous task of sorting through the wreckage, and for some, starting over again..."
world,"Phelps, Thorpe Advance in 200 Freestyle ATHENS, Greece - Michael Phelps took care of qualifying for the Olympic 200-meter freestyle semifinals Sunday, and then found out he had been added to the American team for the evening's 400 freestyle relay final. Phelps' rivals Ian Thorpe and Pieter van den Hoogenband and teammate Klete Keller were faster than the teenager in the 200 free preliminaries..."
world,"Venezuela Opposition Holds Recall Vote CARACAS, Venezuela - The opposition's long and bitter campaign to oust Venezuelan President Hugo Chavez finally came down to a recall referendum Sunday, with the leftist leader hoping a huge turnout among the poor will keep him in power.    Officials from around the world - including Pope John Paul II and U.S..."
world,"Bomb at India Independence Parade Kills 15 NEW DELHI - A bomb exploded during an Independence Day parade in India's remote northeast on Sunday, killing at least 15 people, officials said, just an hour after Prime Minister Manmohan Singh pledged to fight terrorism. The outlawed United Liberation Front of Asom was suspected of being behind the attack in Assam state and a second one later in the area, said Assam Inspector General of Police Khagen Sharma..."
world,"Memorial Service Held for Lori Hacking OREM, Utah - Family and friends of Lori Hacking gathered Saturday for a memorial service to remember the woman whom authorities believe was slain by her husband while she slept.    About 600 people attended the service, including the parents of both Lori Hacking and her husband, Mark, who has been charged with her murder..."
world,"Phelps, Thorpe Advance in 200 Freestyle ATHENS, Greece - Michael Phelps took care of qualifying for the Olympic 200-meter freestyle semifinals Sunday, and then found out he had been added to the American team for the evening's 400 freestyle relay final.    Phelps' rivals Ian Thorpe and Pieter van den Hoogenband and teammate Klete Keller were faster than the teenager in the 200 free preliminaries..."
world,"Pilgrims Crowd Field for Mass With Pope LOURDES, France - A frail Pope John Paul II celebrated an open-air Mass on Sunday as several hundred thousand pilgrims, many in wheelchairs, crowded onto a field near a French shrine to the Virgin Mary that is associated with miraculous cures of the sick.    The Mass was a highlight of the Pope's two-day visit to Lourdes, a town in the Pyrenees where Roman Catholic tradition says St..."
world,Iraqi Troops to Take Lead in Fighting Militia Iraq will send troops to Najaf to battle a Shiite Muslim militia after peace talks collapsed between the government and Moqtada Sadr.
world,High Stakes Showdown in Najaf The fallout from Shiites fighting U.S. Marines in a holy city could weaken Iraq's new government
world,Nearly 10 Million Afghans to Embrace Democracy (Reuters) Reuters - Thousands of U.S. troops in Afghanistan\may have failed to catch Osama bin Laden but they are credited\with encouraging millions of Afghans to register for the\country's historic election in October.
world,"Mortars Mark Opening of Iraqi Political Conference (Reuters) Reuters - Insurgents fired mortars at a meeting\where Iraqi leaders met to pick an interim national assembly\Sunday, killing at least two people in a grim reminder of the\country's tortuous path toward democracy."
world,"Conference Gives Iraq Democracy First Test (AP) AP - Despite the steady clang of mortar shells outside and persistent violence in the country, many delegates at the opening on Sunday of Iraq's National Conference held out hope that this first fragile taste of democracy would succeed."
world,"Countries Run Drills for Panana Attack (AP) AP - The U.S. Coast Guard boarded the ship in the choppy Caribbean waters and began counting crew members, but the numbers did not match those given earlier."
world,"Police push for surveillance fee on customers' phone, Internet bills (Canadian Press) Canadian Press - OTTAWA (CP) - Canada's police chiefs propose a surcharge of about 25 cents on monthly telephone and Internet bills to cover the cost of tapping into the communications of terrorists and other criminals."
world,Bush should have tackled reform before naming CIA boss: lawmaker (AFP) AFP - The top Democrat on the House intelligence committee urged fellow lawmakers not to allow confirmation hearings on a new CIA director to derail efforts to overhaul US spy agencies.
world,"Venezuelans Rush to Vote in Referendum on Chavez  CARACAS, Venezuela (Reuters) - Venezuelans crowded polling  stations on Sunday to vote on whether to recall left-wing  President Hugo Chavez or back his mandate to govern the world's  No. 5 oil exporter for the next two years."
world,"TV: Iraqi Kidnappers of Iran Envoy Want POWs Freed  TEHRAN (Reuters) - Kidnappers holding an Iranian diplomat  in Iraq will ""punish"" him within 48 hours if Iran does not  release 500 prisoners captured in its 1980-1988 war with Iraq,  Iranian state television said Sunday."
world,Nearly 10 Million Afghans to Embrace Democracy  KABUL (Reuters) - Thousands of U.S. troops in Afghanistan  may have failed to catch Osama bin Laden but they are credited  with encouraging millions of Afghans to register for the  country's historic election in October.
world,"Rebranded Liechtenstein Welcomes Fresh Prince  VADUZ, Liechtenstein (Reuters) - The people of  Liechtenstein ushered in a new era Sunday as the tiny Alpine  principality welcomed a new ruler and sought to shed its image  as a haven for money launderers."
world,France marks the 'other D-Day' Two days of celebrations to honour the Allied veterans who liberated southern France near a climax.
world,"Phish farewell attracts thousands ""Jam band"" Phish play their last gigs together at a special festival in the US which has attracted thousands of fans."
world,Iraq troops move angers S Koreans Clashes with riot police erupt as thousands protest in Seoul against plans to send troops to help US-led forces in Iraq.
world,Bush Surveys Damage in Florida as Toll Is Expected to Mount Hurricane Charley - one of the most powerful storms in the nation's history - caused at least \$20 billion in damage in Florida alone.
world,"Phelps, Rival Thorpe in 200M-Free Semis ATHENS, Greece - Michael Phelps took care of qualifying for the Olympic 200-meter freestyle semifinals Sunday, and then found out he had been added to the American team for the evening's 400 freestyle relay final.    Phelps' rivals Ian Thorpe and Pieter van den Hoogenband and teammate Klete Keller were faster than the teenager in the 200 free preliminaries..."
world,"Pope Struggles Through Mass at Lourdes LOURDES, France - A sick man among the sick, Pope John Paul II struggled through Sunday Mass at a French shrine that draws desperate people seeking miracle cures. The 84-year-old pontiff gasped, trembled and asked aides for help during the 2 1/2 hour service in sizzling heat..."
world,"Singh, Leonard in Final Pairing at PGA HAVEN, Wis. - Whistling Straits is suddenly the least of anyone's worries..."
world,"Venezuela Voters Turn Out in Huge Numbers CARACAS, Venezuela - Voters turned out in huge numbers Sunday to decide whether to keep populist President Hugo Chavez in power or oust him and his social revolution that critics say has sidelined the middle class and fueled tensions between rich and poor.    Activists on both sides set off huge firecrackers and played recorded bugle songs to wake voters hours before dawn..."
world,"Reservists Say War Makes Them Lose Jobs WASHINGTON - Increasing numbers of National Guard and Reserve troops who have returned from war in Iraq and Afghanistan are encountering new battles with their civilian employers at home. Jobs were eliminated, benefits reduced and promotions forgotten..."
world,"Wildfire Sweeps by Old Calif. Mining Town REDDING, Calif. - A wind-fueled wildfire roared through an old mining town near Redding on Sunday, destroying 20 homes and forcing nearly 125 residents to flee, officials said..."
world,"Charley Damage Estimated at \$11 Billion PUNTA GORDA, Fla. - As Florida residents began sweeping up the wreckage left behind by Hurricane Charley, officials on Sunday estimated damages as high as \$11 billion for insured homes alone..."
world,"Parks Canada protest greets prime minister at closing of Acadian Congress (Canadian Press) Canadian Press - GRAND PRE, N.S. (CP) - Prime Minister Paul Martin was met with a silent protest Sunday as he attended the closing of the World Acadian Congress in Nova Scotia."
world,"Palestinians in Israeli Jails Start Hunger Strike  RAMALLAH, West Bank (Reuters) - Thousands of Palestinian  prisoners in Israeli jails began a hunger strike for better  conditions on Sunday, but Israel's security minister said he  didn't care if they starved to death."
world,"Frail Pope Ends Tiring Lourdes Pilgrimage  LOURDES, France (Reuters) - Pope John Paul, a sick man  among the sick, wound up a emotional visit to this miracle  shrine Sunday and struggled with iron determination to finish a  sermon in order to encourage others suffering around him."
world,"No Gold for Phelps As Relay Team Falters ATHENS, Greece - Mark Spitz can rest easy. The best Michael Phelps can do is win seven gold medals at these Olympics..."
world,"Dream Team Stunned by Puerto Rico 92-73 ATHENS, Greece - In an upset that was as historic as it was inevitable, the U.S. men's basketball team lost for only the third time ever in the Olympics on Sunday, 92-73 to Puerto Rico..."
world,"Venezuelans Throng to Polls in Chavez Referendum  CARACAS, Venezuela (Reuters) - Venezuelans crowded polling  stations on Sunday to vote on whether to recall left-wing  President Hugo Chavez or back his mandate to govern the world's  No. 5 oil exporter for the next two years."
world,"Pope Struggles Through Mass at Lourdes (AP) AP - A sick man among the sick, Pope John Paul II struggled through Sunday Mass at a French shrine that draws desperate people seeking miracle cures. The 84-year-old pontiff gasped, trembled and asked aides for help during the 2 1/2 hour service in sizzling heat."
world,"Florida Starts Massive Hurricane Cleanup PUNTA GORDA, Fla. - Residents left homeless by Hurricane Charley's 145 mph winds dug through their ravaged homes on Sunday, sweeping up shattered glass and rescuing what they could as President Bush promised rapid delivery of disaster aid..."
world,"Nicky Hilton Marries in Vegas LAS VEGAS - Hotel heiress Nicky Hilton married a New York money manager before dawn Sunday in an impromptu ceremony, according to court filings obtained by The Associated Press.    Hilton, 20, married Todd Andrew Meister, 33, at the Las Vegas Wedding Chapel, according a Clark County marriage license..."
world,"Election-Year Rate Hike Puzzles Some WASHINGTON - Going against conventional wisdom, the Federal Reserve is raising interest rates in an election year. And it is Fed Chairman Alan Greenspan, a Republican, who is leading the charge even though an incumbent Republican in the White House is facing voter unrest about the state of the economy..."
world,"Explosions Echo Throughout Najaf NAJAF, Iraq - U.S. tanks and troops rolled back into the center of Najaf and battled with Shiite militants Sunday, reigniting violence in the holy city just as delegates in Baghdad opened a conference meant to be a landmark in the country's movement toward democracy..."
world,"Venezuela Voters Turn Out in Huge Numbers CARACAS, Venezuela - Summoned by bugle calls and firecrackers, millions of Venezuelans turned out in unprecedented numbers Sunday to vote on whether to force leftist President Hugo Chavez from office.    Lines snaked for blocks in upscale neighborhoods, where suspicion is high that the leftist leader plans a Cuba-style dictatorship, and in the slums, where support for his ""revolution for the poor"" is fervent..."
world,Man Linked to N.J. Gov. Says He's Straight JERUSALEM - The Israeli man at the center of New Jersey Gov. James E...
world,"Venezuela Oil Official Predicts Stability (AP) AP - Venezuela's oil industry will enter a new period of stability and growth after Sunday's referendum on Hugo Chavez's presidency, the president of the state-run oil company said Sunday."
world,"Italy on alert after purported Al-Qaeda ultimatum expires (AFP) AFP - Italy was on high alert as a group linked to Al-Qaeda reportedly threatened to attack, singling out Prime Minister Silvio Berlusconi as a target, after the expiry of a deadline for Rome to pull its troops out of Iraq."
world,"Edwards Caps Intense Push in Iowa (AP) AP - Capping an intense 10-day competition for Iowa's seven electoral votes, Democratic vice presidential nominee John Edwards accused the Bush administration on Sunday of being captured by drug and insurance interests at the expense of working families."
world,Two visions of Iraq struggle to take hold Fighting in Najaf threatened to undermine a conference to choose a national assembly.
world,"Millions Wait Hours in Venezuela to Vote in Recall Election The unprecedented vote was sluggish as huge crowds lined up at voting booths. Results were not expected until 8 p.m., or later."
world,"'Alien Vs. Predator' Smacks Down Rivals LOS ANGELES - Movie-goers were easy prey for a double dose of space invaders. The sci-fi smackdown ""Alien vs..."
world,"U.S. Men Stunned by Puerto Rico, 92-73 ATHENS, Greece - In an upset as historic as it was inevitable, Tim Duncan, Allen Iverson and the rest of the U.S. basketball team lost 92-73 to Puerto Rico on Sunday, only the third Olympic loss ever for America and its first since adding pros..."
world,UN Weighs Situation in Burundi Following Massacre  UNITED NATIONS (Reuters) - The U.N. Security Council met in  emergency session concerning Burundi on Sunday following the  massacre of more than 150 Tutsi Congolese refugees at a camp in  western Burundi.
world,"Rwanda Troops Start AU Mission in Darfur (Reuters) Reuters - Rwandan troops arrived in\Darfur Sunday as the first foreign force there, mandated to\protect observers monitoring a shaky cease-fire between the\Sudanese government and rebels in the remote western region."
world,"Rwanda Troops Start AU Mission in Darfur  EL FASHER, Sudan (Reuters) - Rwandan troops arrived in  Darfur Sunday as the first foreign force there, mandated to  protect observers monitoring a shaky cease-fire between the  Sudanese government and rebels in the remote western region."
world,"U.S. Soldiers Battle Shiites in Najaf NAJAF, Iraq - U.S. tanks and troops rolled back into the center of Najaf and battled with Shiite militants Sunday, reigniting violence in the holy city just as delegates in Baghdad opened a conference meant to be a landmark in the country's movement toward democracy..."
world,"New U.N. Official Assumes Kosovo Control (AP) AP - The new U.N. administrator for Kosovo took control Sunday of the Serbian province, which has remained deeply divided along ethnic lines since the end of a 1999 war."
world,"Venezuelans Line Up to Vote on Chavez CARACAS, Venezuela - Summoned by bugle calls and the detonations of huge firecrackers, Venezuelans turned out in unprecedented numbers Sunday to vote on whether to force leftist President Hugo Chavez from office.    Some lines at polling places extended for 1.25 miles, stunning even veteran election monitors..."
world,"Venezuela Voters Crowd Polls in Chavez Referendum  CARACAS, Venezuela (Reuters) - Venezuelans crowded polling  stations on Sunday to vote on whether to recall left-wing  President Hugo Chavez or back his mandate to govern the world's  No. 5 oil exporter for the next two years."
world,Device 'may aid kidney dialysis' Scientists are developing a device which could improve the lives of kidney dialysis patients.
